{
  "schemaVersion": 1,
  "appId": "zoom-l6max-controller",
  "mixerModel": "ZOOM L6 Max",
  "presetName": "Factory Default",
  "state": {
    "midiChannel": 1,
    "selectedOutputId": "",
    "channels": [
      {
        "id": 1,
        "name": "Channel 1",
        "level": 100,
        "pan": 64,
        "mute": false,
        "aux1": 0,
        "aux2": 0,
        "efx": 0,
        "subMix": 0,
        "eqHi": 64,
        "eqMidFreq": 64,
        "eqMidLevel": 64,
        "eqLo": 64,
        "mapping": {
          "level": "81",
          "pan": "73",
          "mute": "93",
          "aux1": "49",
          "aux2": "57",
          "efx": "65",
          "subMix": "41",
          "eqHi": "1",
          "eqMidFreq": "11",
          "eqMidLevel": "21",
          "eqLo": "33"
        }
      },
      {
        "id": 2,
        "name": "Channel 2",
        "level": 100,
        "pan": 64,
        "mute": false,
        "aux1": 0,
        "aux2": 0,
        "efx": 0,
        "subMix": 0,
        "eqHi": 64,
        "eqMidFreq": 64,
        "eqMidLevel": 64,
        "eqLo": 64,
        "mapping": {
          "level": "82",
          "pan": "74",
          "mute": "94",
          "aux1": "50",
          "aux2": "58",
          "efx": "66",
          "subMix": "42",
          "eqHi": "2",
          "eqMidFreq": "12",
          "eqMidLevel": "22",
          "eqLo": "34"
        }
      },
      {
        "id": 3,
        "name": "Channel 3",
        "level": 100,
        "pan": 64,
        "mute": false,
        "aux1": 0,
        "aux2": 0,
        "efx": 0,
        "subMix": 0,
        "eqHi": 64,
        "eqMidFreq": 64,
        "eqMidLevel": 64,
        "eqLo": 64,
        "mapping": {
          "level": "83",
          "pan": "75",
          "mute": "95",
          "aux1": "51",
          "aux2": "59",
          "efx": "67",
          "subMix": "43",
          "eqHi": "3",
          "eqMidFreq": "13",
          "eqMidLevel": "23",
          "eqLo": "35"
        }
      },
      {
        "id": 4,
        "name": "Channel 4",
        "level": 100,
        "pan": 64,
        "mute": false,
        "aux1": 0,
        "aux2": 0,
        "efx": 0,
        "subMix": 0,
        "eqHi": 64,
        "eqMidFreq": 64,
        "eqMidLevel": 64,
        "eqLo": 64,
        "mapping": {
          "level": "84",
          "pan": "76",
          "mute": "102",
          "aux1": "52",
          "aux2": "60",
          "efx": "68",
          "subMix": "44",
          "eqHi": "4",
          "eqMidFreq": "14",
          "eqMidLevel": "24",
          "eqLo": "36"
        }
      },
      {
        "id": 5,
        "name": "Channel 5",
        "level": 100,
        "pan": 64,
        "mute": false,
        "aux1": 0,
        "aux2": 0,
        "efx": 0,
        "subMix": 0,
        "eqHi": 64,
        "eqMidFreq": 64,
        "eqMidLevel": 64,
        "eqLo": 64,
        "mapping": {
          "level": "85",
          "pan": "77",
          "mute": "103",
          "aux1": "53",
          "aux2": "61",
          "efx": "69",
          "subMix": "45",
          "eqHi": "5",
          "eqMidFreq": "15",
          "eqMidLevel": "25",
          "eqLo": "37"
        }
      },
      {
        "id": 6,
        "name": "Channel 6",
        "level": 100,
        "pan": 64,
        "mute": false,
        "aux1": 0,
        "aux2": 0,
        "efx": 0,
        "subMix": 0,
        "eqHi": 64,
        "eqMidFreq": 64,
        "eqMidLevel": 64,
        "eqLo": 64,
        "mapping": {
          "level": "86",
          "pan": "78",
          "mute": "104",
          "aux1": "54",
          "aux2": "62",
          "efx": "70",
          "subMix": "46",
          "eqHi": "6",
          "eqMidFreq": "16",
          "eqMidLevel": "26",
          "eqLo": "38"
        }
      },
      {
        "id": 7,
        "name": "Channel 7",
        "level": 100,
        "pan": 64,
        "mute": false,
        "aux1": 0,
        "aux2": 0,
        "efx": 0,
        "subMix": 0,
        "eqHi": 64,
        "eqMidFreq": 64,
        "eqMidLevel": 64,
        "eqLo": 64,
        "mapping": {
          "level": "87",
          "pan": "79",
          "mute": "105",
          "aux1": "55",
          "aux2": "63",
          "efx": "71",
          "subMix": "47",
          "eqHi": "7",
          "eqMidFreq": "17",
          "eqMidLevel": "27",
          "eqLo": "39"
        }
      },
      {
        "id": 8,
        "name": "Channel 8",
        "level": 100,
        "pan": 64,
        "mute": false,
        "aux1": 0,
        "aux2": 0,
        "efx": 0,
        "subMix": 0,
        "eqHi": 64,
        "eqMidFreq": 64,
        "eqMidLevel": 64,
        "eqLo": 64,
        "mapping": {
          "level": "88",
          "pan": "80",
          "mute": "106",
          "aux1": "56",
          "aux2": "64",
          "efx": "72",
          "subMix": "48",
          "eqHi": "8",
          "eqMidFreq": "18",
          "eqMidLevel": "28",
          "eqLo": "40"
        }
      }
    ],
    "globals": {
      "compressor": false,
      "mono5": false,
      "mono6": false,
      "usb12": false,
      "usb34": false,
      "efxType": 0
    },
    "globalMapping": {
      "compressor": "119",
      "mono5": "109",
      "mono6": "110",
      "usb12": "113",
      "usb34": "114",
      "efxType": "117"
    }
  }
}

